,,,,,,,,connect_me,crop,freetime
友善食材、低添加物、或傳統技藝的加工業者,友善食品加工,,hackfoldr標記(會與「介紹」合併),介紹,地址,"經緯度(程式自動補完, 也可手動訂正)",,聯絡方式,販售農產品項目,服務時間
,,,,,,,,,,
http://bowtoland.blogspot.com/,陳櫻花(福和自然田園),,,秀明自然農夫的農產品加工。,雲林縣二崙鄉崙東村中華路11號,"23.766251?? 120.428902",,05-5988398;0963-008558;chen0801@gmail.com,當季蔬菜、水果、自製甜/鹹包子、果醬等,
http://www.move-bee.com,牧蜂農莊養蜂場,,,牧蜂農莊，位於環境靜謐清幽的三芝鄉芝柏山莊內，農莊三面環山，佔地近三公頃，環境清幽。農莊成立至今已有三年時間，除了養蜂示範教學以外，還兼具觀光、產業等機能，並自產自銷提供餐飲、伴手禮服務，且採免費入場制，是三芝鄉最具知名度的旅遊景點之一。,新北市三芝茂長村74號,"25.260801?? 121.508553",,02-26363742;0928235619,蜂蜜,
http://www.beans-family.com/,豆之家食品科技股份有限公司,,,"我們日常食用的食品，許多商人由於利益的考量，因此添加了許多的化學成份，如果這些化學成份長期累積在體內、我們的土地上，將會對人體及環境造成危害，但消費者迫於現實，只能無奈的接受。 有感於此，本公司的創辦人－洪熒曜總經理，秉持著對人們的關愛及對土地的熱愛，決定貢獻一己之力，投身研發、製造健康零食，不以商業利益為最優先考量，不惜成本，嚴選各種優質天然果物，以適宜的工法製程，留住食材的美味與營養，並致力於推廣無添加，只給您高品質的產品。",桃園縣蘆竹南崁路二段226巷31號,"25.05945?? 121.273941",,市內電話：03-3216699;傳真：03-3522969,零食、果乾、芥茉豆,"星期一~星期五08:00 ~ 17:00"
